<?xml version='1.0' encoding='utf-8'?>
<!-- Created by Darjus Hosszejni
                Institute for Statistics and Mathematics
                WU Vienna -->
<learning_resources xmlns="https://www.learn.wu.ac.at" xmlns:xsi="http://www.w3.org/2001/XMLSchema-instance" xsi:schemaLocation="learn-msq.xsd">
 <exercise area="QM2" restype="excs" shortname="exshortname">
  <metadata>
   <time>1</time>
   <category area="QM2" restype="csp" shortname="catshortname"/>
   <title>Title</title>
  </metadata>
  <question_data>
   <multiplechoice>
    <problem_text>
     <p>A new question with formula <span class="math-tex">\(x = {-b \pm \sqrt{b^2-4ac} \over 2a}\)</span></p>
    </problem_text>
    <answer value="false">
     <answer_text>
      <p align="left">First</p>
     </answer_text>
    </answer>
    <answer value="false">
     <answer_text>
      <p align="left">Second</p>
     </answer_text>
    </answer>
    <answer value="true">
     <answer_text>
      <p align="left">Third</p>
     </answer_text>
    </answer>
    <answer value="false">
     <answer_text>
      <p align="left">Fourth</p>
     </answer_text>
    </answer>
    <answer value="false">
     <answer_text>
      <p align="left">Fifth</p>
     </answer_text>
    </answer>
    <feedback>
        <p>This is the feedback</p>
    </feedback>
   </multiplechoice>
  </question_data>
 </exercise>
</learning_resources>